{
  "$schema": "https://json-schema.org/draft/2020-12/schema",
  "$id": "https://w3id.org/plato/schemas/place-centric.schema.json",
  "title": "PLATO Place-Centric Profile",
  "description": "A document of one or more SpatialEntities, each with its attestations nested under it: the shape for a dataset of its own places, such as a gazetteer or a converted Linked Places Format file (LPF is PLATO's single-object-attestation profile, and remains valid as it is). Each SpatialEntity carries its own attestations, which do not give an 'about' field: it is implicit from the nesting.",
  "type": "object",
  "properties": {
    "$schema": {
      "type": "string",
      "const": "https://w3id.org/plato/schemas/place-centric.schema.json"
    },
    "@context": {
      "description": "The JSON-LD context, so that a JSON-LD processor reads the document as RDF in the PLATO ontology: https://w3id.org/plato/schemas/plato.context.jsonld, or a list or object that includes it. Optional: a tool that knows PLATO applies the context whether or not the document names it.",
      "anyOf": [
        { "type": "string", "format": "uri" },
        { "type": "object" },
        { "type": "array", "items": { "anyOf": [{ "type": "string", "format": "uri" }, { "type": "object" }] } }
      ]
    },
    "profile": {
      "type": "string",
      "const": "place-centric",
      "description": "Identifies this as a place-centric document."
    },
    "gazetteer": {
      "type": "object",
      "description": "Metadata about the contributing gazetteer.",
      "properties": {
        "@id": {
          "$ref": "plato.schema.json#/$defs/uri",
          "description": "URI of the gazetteer, if it already exists in the system."
        },
        "title": {
          "type": "string",
          "description": "Gazetteer title."
        },
        "description": {
          "type": "string"
        },
        "contributor": {
          "type": "string",
          "description": "Contributor name or URI."
        },
        "creator": {
          "type": "array",
          "minItems": 1,
          "description": "The people or organisations to cite as the dataset's authors (dcterms:creator), each with a web address such as an ORCID, a name, or both. Not the same as contributor, the gazetteer's owner.",
          "items": {
            "type": "object",
            "properties": {
              "@id": {
                "$ref": "plato.schema.json#/$defs/uri",
                "description": "A persistent address for the person or organisation: an ORCID, a ROR."
              },
              "name": {
                "type": "string",
                "description": "Their name (foaf:name)."
              }
            },
            "anyOf": [
              {
                "required": [
                  "@id"
                ]
              },
              {
                "required": [
                  "name"
                ]
              }
            ],
            "additionalProperties": false
          }
        },
        "licence": {
          "$ref": "plato.schema.json#/$defs/uri",
          "description": "The web address of the dataset's licence (dcterms:license), such as https://creativecommons.org/licenses/by/4.0/. Required once status is 'published'."
        },
        "version": {
          "type": "string",
          "description": "The gazetteer's version indicator (dcat:version): '2026-09', '1.4'. A place is cited as its IRI plus this version."
        },
        "status": {
          "type": "string",
          "enum": [
            "draft",
            "published"
          ],
          "description": "Publication status (plato:gazetteer_status). Once 'published', the gazetteer's attestations are append-only: never deleted or changed, only superseded or retracted by new ones."
        },
        "isVersionOf": {
          "$ref": "plato.schema.json#/$defs/uri",
          "description": "For a frozen snapshot: the living gazetteer it is a version of (dcat:isVersionOf)."
        },
        "previousVersion": {
          "$ref": "plato.schema.json#/$defs/uri",
          "description": "For a frozen snapshot: the snapshot before it (dcat:previousVersion)."
        },
        "keywords": {
          "type": "array",
          "items": {
            "type": "string"
          },
          "description": "Words a catalogue can find the dataset by (dcat:keyword)."
        },
        "spatial": {
          "type": "array",
          "items": {
            "$ref": "plato.schema.json#/$defs/uri"
          },
          "description": "The area the dataset covers, as web addresses (dcterms:spatial): a Wikidata or GeoNames region."
        },
        "temporal": {
          "type": "object",
          "description": "The years the dataset covers (dcterms:temporal, a dcterms:PeriodOfTime).",
          "properties": {
            "startDate": {
              "$ref": "plato.schema.json#/$defs/isoOrYear",
              "description": "The earliest date covered (dcat:startDate)."
            },
            "endDate": {
              "$ref": "plato.schema.json#/$defs/isoOrYear",
              "description": "The latest date covered (dcat:endDate)."
            }
          },
          "additionalProperties": false
        },
        "landingPage": {
          "$ref": "plato.schema.json#/$defs/uri",
          "description": "The web page where people find and download the dataset (dcat:landingPage)."
        },
        "uriSpace": {
          "type": "string",
          "format": "uri",
          "description": "The base from which the dataset's places, sources and other entities have their web addresses (void:uriSpace), e.g. https://w3id.org/whg-epns/. Choose one you control and will keep."
        }
      },
      "required": [
        "title"
      ],
      "additionalProperties": false,
      "allOf": [
        {
          "if": {
            "properties": {
              "status": {
                "const": "published"
              }
            },
            "required": [
              "status"
            ]
          },
          "then": {
            "required": [
              "licence"
            ]
          }
        }
      ]
    },
    "dataSets": {
      "type": "array",
      "description": "The statistical tables the document's figures belong to.",
      "items": {
        "$ref": "plato.schema.json#/$defs/dataSet"
      }
    },
    "relationTypes": {
      "type": "array",
      "description": "Relation types the document declares for its own use, each with the PLATO type it narrows.",
      "items": {
        "$ref": "plato.schema.json#/$defs/relationType"
      }
    },
    "spatialEntities": {
      "type": "array",
      "description": "The document's SpatialEntities, each with its attestations nested. A SpatialEntity may have no attestations: it is then only a referent, such as the target of a relation, and its label is not evidence.",
      "items": {
        "allOf": [
          {
            "$ref": "plato.schema.json#/$defs/spatialEntity"
          },
          {
            "type": "object",
            "properties": {
              "attestations": {
                "type": "array",
                "items": {
                  "allOf": [
                    {
                      "$ref": "plato.schema.json#/$defs/attestation"
                    },
                    {
                      "type": "object",
                      "description": "In place-centric mode, 'about' is implicit (the enclosing SpatialEntity) and should be omitted.",
                      "not": {
                        "required": [
                          "about"
                        ]
                      }
                    }
                  ]
                }
              },
              "identityRelations": {
                "type": "array",
                "description": "Identity assertions whose subject is the enclosing SpatialEntity. 'subject' is implicit from the nesting and may be omitted; if it is given, it must be the enclosing SpatialEntity's @id.",
                "items": {
                  "$ref": "plato.schema.json#/$defs/identityRelation"
                }
              }
            }
          }
        ]
      },
      "minItems": 1
    },
    "identityRelations": {
      "type": "array",
      "description": "Identity assertions between SpatialEntities in this document, or between them and SpatialEntities elsewhere.",
      "items": {
        "allOf": [
          {
            "$ref": "plato.schema.json#/$defs/identityRelation"
          },
          {
            "type": "object",
            "description": "At the top level nothing supplies the subject, so it must be given.",
            "required": [
              "subject"
            ]
          }
        ]
      }
    }
  },
  "required": [
    "profile",
    "gazetteer",
    "spatialEntities"
  ],
  "additionalProperties": false
}
